{
  "meta": {
    "description": "A policy problem-instrument map derived from Ohno's Learning to Industrialize. Seven concrete root problems replace the single abstract 'middle-income trap' root. Each root is directly mappable to policy instruments.",
    "version": 2
  },
  "problems": [
    {
      "id": 1,
      "parent": null,
      "name": "Low Enterprise Productivity and Quality",
      "statement": "Domestic firms, especially SMEs, operate with low productivity and poor quality, limiting their ability to compete and upgrade.",
      "description": "Weak firm-level capability is a root cause of failed industrial upgrading. SMEs lack management, technical, and quality control capabilities, and cannot absorb technology effectively.",
      "goals": [
        "Upgrade SME management and technology",
        "Improve quality and reduce defects",
        "Increase productivity",
        "Build technology absorption capability"
      ],
      "granularity": "broad",
      "policyDomain": "Enterprise Development",
      "targetGroup": "Domestic Firms, SMEs",
      "references": [
        {
          "label": "Ohno, K. (2013). Learning to industrialize: From given growth to policy-aided value creation (Chapter 4). Routledge."
        }
      ]
    },
    {
      "id": 2,
      "parent": null,
      "name": "Missing Supporting Industries and Weak FDI Linkages",
      "statement": "Domestic supporting industries are too weak to supply core firms, and FDI operates in enclaves with few local linkages.",
      "description": "Without supplier development and local absorptive capacity, FDI generates limited spillovers. Supporting industries are essential for clustering and value chain integration.",
      "goals": [
        "Develop supporting industries",
        "Increase local content",
        "Integrate local firms into value chains",
        "Maximize learning from FDI"
      ],
      "granularity": "broad",
      "policyDomain": "Industrial Structure and Linkage",
      "targetGroup": "SMEs, Suppliers, MNCs",
      "references": [
        {
          "label": "Ohno, K. (2013). Learning to industrialize: From given growth to policy-aided value creation (Chapter 3). Routledge."
        }
      ]
    },
    {
      "id": 3,
      "parent": null,
      "name": "Shortage of Industrial Human Resources",
      "statement": "There is a critical shortage of engineers, technicians, managers, and skilled workers needed for industrial upgrading.",
      "description": "Industrialization requires a critical mass of capable people who can absorb, adapt, and create technology. TVET systems are disconnected from industry needs, and skill mismatch is widespread.",
      "goals": [
        "Build industrial human resources",
        "Improve technical and vocational training",
        "Link skills to industry needs",
        "Develop industrial managers"
      ],
      "granularity": "broad",
      "policyDomain": "Human Capital Development",
      "targetGroup": "Engineers, Technicians, Managers, Workers",
      "references": [
        {
          "label": "Ohno, K. (2013). Learning to industrialize: From given growth to policy-aided value creation (Chapter 5). Routledge."
        }
      ]
    },
    {
      "id": 4,
      "parent": null,
      "name": "Financial Constraints for Industrial Investment",
      "statement": "Firms, especially SMEs, cannot obtain adequate finance for equipment, technology, and working capital.",
      "description": "Financial constraints prevent firms from upgrading. Collateral requirements, weak credit information, and lack of long-term finance are key obstacles.",
      "goals": [
        "Improve access to industrial finance",
        "Reduce lending risk for SMEs",
        "Build credit information systems",
        "Provide long-term finance"
      ],
      "granularity": "broad",
      "policyDomain": "Industrial Finance",
      "targetGroup": "SMEs, Targeted Industries",
      "references": [
        {
          "label": "Ohno, K. (2013). Learning to industrialize: From given growth to policy-aided value creation (Chapter 4). Routledge."
        }
      ]
    },
    {
      "id": 5,
      "parent": null,
      "name": "Weak Policy Process and Governance",
      "statement": "Government lacks the capability to design, implement, and adapt industrial policies suited to local conditions.",
      "description": "Policy capacity includes diagnosis, dialogue with the private sector, learning from international experience, coordination across agencies, and implementation discipline.",
      "goals": [
        "Build policy-making capability",
        "Establish policy dialogue",
        "Ensure coordination and implementation",
        "Adapt policies to local context"
      ],
      "granularity": "broad",
      "policyDomain": "Policy Process and Governance",
      "targetGroup": "Policy Makers, Bureaucrats",
      "references": [
        {
          "label": "Ohno, K. (2013). Learning to industrialize: From given growth to policy-aided value creation (Chapters 6-7). Routledge."
        }
      ]
    },
    {
      "id": 6,
      "parent": null,
      "name": "Infrastructure and Business Environment Bottlenecks",
      "statement": "Poor infrastructure, logistics, and administrative burden raise costs and reduce industrial competitiveness.",
      "description": "Reliable power, transport, industrial parks, and efficient administration are necessary for industrial investment and cluster development.",
      "goals": [
        "Provide reliable industrial infrastructure",
        "Reduce logistics costs",
        "Develop quality industrial parks",
        "Reduce administrative burden"
      ],
      "granularity": "broad",
      "policyDomain": "Infrastructure and Business Environment",
      "targetGroup": "Firms, Investors",
      "references": [
        {
          "label": "Ohno, K. (2013). Learning to industrialize: From given growth to policy-aided value creation (Chapter 3). Routledge."
        }
      ]
    },
    {
      "id": 7,
      "parent": null,
      "name": "Dependence on Given Growth Sources",
      "statement": "Growth depends on externally given advantages—resources, aid, big projects, or FDI enclaves—rather than on created value.",
      "description": "Given growth arises from FDI, aid, resource rents, or large public projects. It can produce temporary growth but does not build endogenous industrial capability.",
      "goals": [
        "Reduce dependence on exogenous growth sources",
        "Convert given advantages into created advantages",
        "Diversify away from resource rents",
        "Balance big projects with broad industrial support"
      ],
      "granularity": "broad",
      "policyDomain": "Structural Change",
      "targetGroup": "National Economy",
      "references": [
        {
          "label": "Ohno, K. (2013). Learning to industrialize: From given growth to policy-aided value creation (Chapters 1-2). Routledge."
        }
      ]
    },
    {
      "id": 8,
      "parent": 1,
      "name": "Weak SME Management and Technology Capability",
      "statement": "SMEs lack management, technical, and quality control capabilities.",
      "description": "SME upgrading is central to industrial deepening. Without it, domestic firms cannot supply MNCs or compete in export markets.",
      "goals": [
        "Upgrade SME management",
        "Improve technology use",
        "Raise productivity"
      ],
      "granularity": "detailed",
      "policyDomain": "SME Development",
      "targetGroup": "SMEs",
      "references": [
        {
          "label": "Ohno, K. (2013). Learning to industrialize: From given growth to policy-aided value creation (Chapter 4). Routledge."
        }
      ]
    },
    {
      "id": 9,
      "parent": 1,
      "name": "Poor Quality and Productivity",
      "statement": "Firms produce low-quality goods with high defect rates and low productivity.",
      "description": "Quality and productivity problems limit market access and upgrading.",
      "goals": [
        "Improve quality",
        "Reduce defects",
        "Increase productivity"
      ],
      "granularity": "detailed",
      "policyDomain": "Enterprise Development",
      "targetGroup": "Manufacturing Firms",
      "references": [
        {
          "label": "Ohno, K. (2013). Learning to industrialize: From given growth to policy-aided value creation (Chapter 4). Routledge."
        }
      ]
    },
    {
      "id": 10,
      "parent": 1,
      "name": "Low Technology Absorption",
      "statement": "Firms cannot absorb, adapt, and improve imported technology.",
      "description": "Technology absorption requires technical skills, enterprise effort, and supporting institutions.",
      "goals": [
        "Improve technology absorption",
        "Adapt foreign technology to local conditions",
        "Move toward innovation"
      ],
      "granularity": "detailed",
      "policyDomain": "Technology and Innovation",
      "targetGroup": "Firms, Engineers",
      "references": [
        {
          "label": "Ohno, K. (2013). Learning to industrialize: From given growth to policy-aided value creation (Chapters 4-5). Routledge."
        }
      ]
    },
    {
      "id": 11,
      "parent": 2,
      "name": "Missing Supporting Industries",
      "statement": "Domestic supporting industries are too weak to supply core firms.",
      "description": "Supporting industries are essential for clustering and FDI linkage. Their absence raises import dependence and limits spillovers.",
      "goals": [
        "Develop supporting industries",
        "Increase local content",
        "Build supplier clusters"
      ],
      "granularity": "detailed",
      "policyDomain": "Industrial Structure",
      "targetGroup": "SMEs, Suppliers",
      "references": [
        {